{
  "clarification_requests": [],
  "consumption_id": "ui_ux_1_201_post_direction_oci_consumption",
  "created_at": "2026-09-08T17:06:02.300189+00:00",
  "knowledge_items_applied": [
    "conditioned_autonomy",
    "compress_occurrences_into_decisions",
    "evidence_before_closure",
    "focal_group_canonical_deep_test_policy",
    "preserve_contract_until_explicit_change",
    "real_diff_over_planned_commit_name",
    "station_local_commits",
    "true_hard_frontier"
  ],
  "knowledge_items_available": [
    "compress_occurrences_into_decisions",
    "conditioned_autonomy",
    "evidence_before_closure",
    "focal_group_canonical_deep_test_policy",
    "local_rollback",
    "preserve_contract_until_explicit_change",
    "real_diff_over_planned_commit_name",
    "station_local_commits",
    "true_hard_frontier"
  ],
  "knowledge_items_conflicted": [],
  "knowledge_items_helpful": [
    "conditioned_autonomy",
    "compress_occurrences_into_decisions",
    "evidence_before_closure",
    "focal_group_canonical_deep_test_policy",
    "preserve_contract_until_explicit_change",
    "real_diff_over_planned_commit_name",
    "station_local_commits",
    "true_hard_frontier"
  ],
  "knowledge_items_irrelevant": [],
  "knowledge_items_selected": [
    "compress_occurrences_into_decisions",
    "conditioned_autonomy",
    "evidence_before_closure",
    "focal_group_canonical_deep_test_policy",
    "local_rollback",
    "preserve_contract_until_explicit_change",
    "real_diff_over_planned_commit_name",
    "station_local_commits",
    "true_hard_frontier"
  ],
  "knowledge_items_unused": [
    "local_rollback"
  ],
  "mission_id": "ui_ux_1_201_post_direction_microcopy_review_and_oci_feedback",
  "new_candidates": [],
  "operator_interventions": [],
  "pack_id": "gokv.pack.3ec8e3b20cc39e56",
  "pack_item_count": 9,
  "pack_size_bytes": 9727,
  "result": "OCI_1_201_CONSUMED_IN_DEVELOPMENT_REVIEW",
  "schema_version": "gokv.oci_consumption_result.v1"
}
